その結果、受注高は 3,708百万円と前連結会計年度に比べ 571百万円の増加（＋18.2％）、売上高は 3,373百万円と前連結会計年度に比べ 562百万円の減少（△14.3％）となり、セグメント利益（営業利益）は 235百万円と前連結会計年度に比べ 317百万円の減少（△57.4％）となりました	0
営業利益は事業再編利益の差等により、前連結会計年度比69％の236億２千２百万円となりました	0
税引前当期利益は前連結会計年度比97％の238億５千９百万円、親会社株主に帰属する当期利益は前連結会計年度比91％の80億２千２百万円となりました	0
両製品ともに、特に超大型クラスの需要低迷が続きました	0
連結売上収益は、前連結会計年度比99％の7,472億５千６百万円となりました	0
かかる情勢の下での当社グループ（当社、連結子会社及び持分法適用会社）の経営成績は、用地代・建築コストが依然として高止まりの状況にあることから引き続きマンション建設事業を抑制したことによる売上高の減少、及び前年同期に伸長をした東北の復興需要による型枠製造に係る売上高の反動減の結果、売上高は、8,744百万円と前年同期に比べ1,489百万円（14.6％）減少、営業利益は、594百万円と前年同期に比べ463百万円（43.8％）減少し、経常利益は、574百万円と前年同期に比べて440百万円（43.4％）減少しました	0
本事業においては、プラスチック押出機及び試験機などの売上は堅調に推移したものの、前年同期に伸長をした東北の復興需要による型枠製造に係る売上高の反動減を補うまでには至らず、売上高は2,887百万円と前年同期に比べ712百万円減少し、セグメント損失は112百万円（前年同期セグメント利益204百万円）となりました	0
本事業においては、マンション建設事業を抑制したことにより、売上高は6,177百万円と前年同期に比べ774百万円減少しました	0
セグメント利益は、防蟻・防水・断熱工事等の住宅関連事業において収益性が向上し、セグメント利益の向上に貢献はしたものの、上記売上高の減少を補うまでには至らず、645百万円と前年同期に比べ56百万円減少しました	0
本事業においては、売上高は535百万円と前年同期に比べ25百万円減少し、セグメント利益は、82百万円と前年同期に比べ75百万円の減少となりました	0
当事業年度におけるわが国経済は、企業収益や設備投資に改善が見られ、景気は緩やかな回復基調で推移しましたが、英国のＥＵ離脱問題や米国の大統領選挙の結果、欧州でのテロや極東地域の政情不安などの影響により海外経済の不確実性が高まるなか、為替市場や国際商品市況が不安定な状況で推移いたしました	0
このような状況のなか、当事業年度の売上高は、ＬＰガス容器用弁については年初からの販売価格の見直しにより販売単価は改善しましたが、ＬＰガス容器の耐圧検査需要が伸び悩むなかで競合他社との競争が激化したことにより前年対比で減少しました	0
また、鉄鋼製装置用弁は、年初からの販売価格の見直しに対し前期末に駆け込み需要があったこと、および造船市場の冷え込みにより海上用輸送用弁が減少したため前年対比で減少しました	0
以上により、売上高は4,514百万円（前年同期比12.0％減）となりました	0
損益面につきましては、主要原材料の黄銅材価格が当期の後半より上昇したものの平均して前期より低い水準で推移したこと、および原価低減施策（工場の稼働率の維持・向上を目指し平準化生産を徹底したことや部品の内製化を進めたこと）が奏功し利益改善につながりました	0
また、特別利益に破産更生債権等（全額引当済）に計上していたＭＳエイジア株式会社等に対する債権回収として71百万円、甲府工場設置の太陽光発電等に係る補助金収入48百万円および役員退職慰労引当金戻入額17百万円を計上し、一方で、特別損失に事業撤退損24百万円を計上したことにより当期純利益は199百万円（前年同期比13.0％減）となりました	0
しかしながら、日本工作機械工業会による2016年度の工作機械受注額は前年比7.9％減の1兆2,891億円となるなど、ものづくり産業全般の設備投資動向については、やや厳しい環境下におかれております	0
このような環境のもと、当事業年度における売上高は、前年比5.6％減の4,115,823千円（うち輸出1,060,577千円　全売上高の25.8％）と２年連続の減収となりました	0
なお、機種分類別の内訳と致しましては、木工機械については大型案件の堅調な需要があり、前年比30.0％増の2,728,073千円(うち輸出673,860千円)となりましたが、工作機械については海外市場の落ち込みや航空機関連等の低迷により、前年比38.7％減の1,387,750千円(うち輸出386,717千円)となりました	0
当連結会計年度（以下、当期という）におけるわが国経済は、政府や日銀による経済・金融政策を背景に雇用・所得環境の改善が見られたものの、中国をはじめとする新興諸国の成長鈍化や資源安の長期化に加えて、英国のEU（欧州連合）離脱問題や米国新政権移行に伴う影響などによる株式市場や為替相場の急激な変動もあり、景気の先行きは不透明な状況が続きました	0
このような状況の中、当社グループは顧客満足度の向上を経営方針として掲げ、新たな価値の創出にチャレンジすることを柱とした中期経営計画を遂行してまいりましたが、当期における受注高は、船舶用機器や水処理装置の受注が振るわず、95億42百万円（前期比4.2％減）にとどまりました	0
また、売上高は、前期の受注低迷の影響と既設海水淡水化プラントのリハビリ（機能回復・延命）工事の売上が前期と比べて少なかったことから、102億33百万円（同20.9％減）となり、受注残高は154億41百万円（同3.1％減）となりました	0
損益面につきましては、十分な売上が確保できなかったことに加えて、サウジアラビア向け海水淡水化プラントの採算性の悪化により受注損失引当金４億97百万円の追加計上を行ったことから、営業損益は１億65百万円の損失（前期は４億19百万円の利益）となり、経常損益は１億90百万円の損失（前期は１億79百万円の利益）となりました	0
また、特別利益として投資有価証券売却益４億98百万円に加え、本年３月に持分法適用会社ARABIAN COMPANY AND SASAKURA FOR WATER AND POWERの株式を追加取得し連結子会社としたことによる当該株式の段階取得に係る差益を６億99百万円計上した一方、特別損失として同社の将来キャッシュ・フロー予測に基づく回収可能性を検討した結果、のれん17億２百万円の減損損失を計上したことから、親会社株主に帰属する当期純損益は10億13百万円の損失（前期は34百万円の利益）となりました	0
世界の荷動きの低迷による船腹過剰感から運賃や新造船受注は大幅に低迷し、海運業界ならびに造船業界は業界再編に動くなど、厳しい状況となり、当期における受注高は22億28百万円（前期比10.1％減）となりました	0
また、売上高は24億76百万円（同12.9％減）となり、営業利益は１億95百万円（同50.4％減）、受注残高は13億３百万円（同16.6％減）となりました	0
空冷式熱交換器の受注が堅調に推移したものの、その他の機器の受注が減少したことから、受注高は26億４百万円（同3.6％減）となりました	0
海水淡水化装置、蒸発濃縮装置ともに受注が振るわず、受注高は24億10百万円（同26.0％減）となりました	0
売上高は、既設海水淡水化プラントのリハビリ工事の売上が前期と比べて少なかったことから、26億82百万円（同57.6％減）となり、営業損益は売上が大幅に減少したことに加え、サウジアラビア向け海水淡水化プラント工事の長期中断に伴って採算性が悪化したことから受注損失引当金の追加計上を行い、５億３百万円の損失（前期は１億40百万円の利益）、受注残高は98億54百万円（前期比2.6％減）となりました	0
損益につきましては、経常利益８億98百万円(前年同期比21.5％減)、親会社株主に帰属する当期純利益７億10百万円(同39.9％減)となりました	0
受注高は92億11百万円（前年同期比16.6％増）、売上高は68億40百万円（同14.5％減）、セグメント利益は14億43百万円（同12.9％減）となりました	0
電子部品業界では、既存技術応用分野及び新規市場の開拓に注力しましたが、前期好調に推移したスマートフォン向け圧電部品の製造用装置の反動減により、受注・売上ともに前年同期に対して減少となりました	0
電子部品装置・その他装置の受注高は17億72百万円（前年同期比63.0％減）、売上高は24億９百万円(同49.1％減)となりました	0
サービス事業の売上高は17億99百万円（前年同期比14.1％減）、セグメント利益は４億７百万円（同12.6％減）となりました	0
このような環境のもとで、当連結会計年度の売上高は前連結会計年度に比べて為替相場が円高で推移したことなどから189億61百万円（前年同期比1.2％減）となりました	0
①　工業用ミシンにつきましては、縫製産地の流動化に応じた販売戦略の展開および高級機種需要など市場ニーズへの対応に努めましたが、円高の影響により売上高は162億51百万円（前年同期比1.2％減）となりました	0
国内においては、海外経済の先行き不透明感の強まりを受け、為替が短期間で急激に変動したものの、全体としては緩やかな回復基調となりました	0
部門別には「発電・社会インフラ」、「産業インフラ」は前連結会計年度を上回りましたが、「パワエレ機器」、「電子デバイス」、「食品流通」、「その他」は前連結会計年度を下回りました	0
売上高は前連結会計年度比1%減少の2,058億55百万円となり、営業損益は前連結会計年度比7億91百万円減少の86億40百万円となりました	0
パワーサプライ分野は、メガソーラー向けパワーコンディショナの需要減少及び為替影響により、売上高は前連結会計年度を下回りましたが、原価低減等の推進により、営業損益は前連結会計年度を上回りました	0
器具分野は、工作機械をはじめとする機械セットメーカ及び受配電盤メーカの需要減少により、売上高、営業損益ともに前連結会計年度を下回りました	0
売上高は前連結会計年度比1%減少の1,184億62百万円となり、営業損益は前連結会計年度比17億49百万円減少の80億30百万円となりました	0
ディスク媒体分野は、市況悪化に伴う需要減少により、売上高、営業損益ともに前連結会計年度を下回りました	0
売上高は前連結会計年度比若干減少の1,095億57百万円となり、営業損益は前連結会計年度比19億98百万円減少の60億29百万円となりました	0
自販機分野は、国内市場の業界再編及び国内飲料メーカーの投資抑制に伴う需要減少、中国市場においては、顧客開拓は進むものの、設置計画の見直し等が影響し、売上高、営業損益ともに前連結会計年度を下回りました	0
売上高は前連結会計年度比6%減少の590億99百万円となり、営業損益は前連結会計年度比２億71百万円減少の20億64百万円となりました	0
また、損益面につきましては、営業利益は11億45百万円（同5.2％減）となりました	0
海外においても、中国を始めとする新興国経済の減速及び欧米の政治情勢の先行き不透明感により弱めの動きとなりました	0
当社の主要顧客である造船業界においては、中国経済の減速等による海運市況の長期低迷に伴う船腹過剰、また一昨年の窒素酸化物３次規制の適用前の駆け込み発注に対する反動もあり、受注量は大幅に減少しており厳しい状況が続きました	0
このような状況のもと、当連結会計年度の業績につきましては、機器製品及びアジア地域での船舶用システム製品の売上の減少、為替の円高推移の影響などもあり、売上高は328億円73百万円と前年同期比16.6％の減少となりました	0
利益面では、原価低減、経費削減に努めましたが、売上高の減少による影響、本社移転に関する経費等もあり、営業利益は18億38百万円と前年同期比49.8％の減益となり、経常利益につきましても、23億72百万円と前年同期比39.6％の減益となりました	0
親会社株主に帰属する当期純利益は、旧本社の土地売却による特別利益を計上しておりますが、19億８百万円と前年同期比30.3％の減益となりました	0
なお、製品別の連結売上高は、システム製品（配電制御システム等）が187億６百万円と前年同期比13.1％の減少、機器製品（低圧遮断器等）が141億67百万円と前年同期比20.7％の減少となりました	0
当社グループのシステム製品の連結受注高は、当連結会計年度においては、船舶用システム製品は、国内造船所向けのコンテナ船のシリーズ船の受注、産業用システム製品は、海外プラントや国内外の鉄道関連向けの受注がありましたが、アジア地域における船舶用システム製品が低調に推移したこと等により前年同期を18.4％下回る172億36百万円となりました	0
その結果、連結受注残高は前連結会計年度末より14億69百万円減少し、179億27百万円となりました	0
エンジニアリング及びライフサイクルサービスは、産業向けの更新工事などが前年同期に比べ増加しましたが、船舶向けの各種点検作業等が低調に推移したことにより、売上が前年同期に比べ減少しました	0
機器製品（低圧遮断器等）は、国内向けでは、マーケットの停滞により売上が減少、海外向けについても、東アジアの船舶市場、オセアニア地域の売上減少等により、機器製品全体の売上は、前年同期に比べ減少しました	0
その結果、当セグメントの当連結会計年度の売上高は、224億23百万円と前年同期比6.0％の減少、セグメント利益は、機器製品の売上減少、本社移転に関する経費等により、15億95百万円と前年同期比39.4％の減益となりました	0
船舶用システム製品（船舶用配電制御システム等）では、海運市況の悪化に伴う中国造船市場向け及び資源安による東南アジアにおける海洋掘削市場向けの受注低迷、納期遅延、キャンセル発生などにより、売上は前年同期に比べ大幅に減少しました	0
その結果、当セグメントの当連結会計年度の売上高は、73億98百万円と前年同期比32.3％の減収、セグメント利益は９億67百万円と前年同期比38.0％の減益となりました	0
機器製品（低圧遮断器等）は、英国内の景気の停滞、中近東向けについても資源安による市況の停滞により、売上は前年同期に比べ減少しました	0
その結果、当セグメントの当連結会計年度の売上高は、30億55百万円と前年同期比32.5％の減少、セグメント利益は全体の売上減少等もあり、１億27百万円と前年同期比56.2％の減益となりました	0
このような状況の中、当連結会計年度の売上高は、カーエレクトロニクスが主にＯＥＭ事業において減少したことや、円高の影響などにより、前連結会計年度に比べ、14.0％減収の386,682百万円となりました	0
また、親会社株主に帰属する当期純利益は、営業利益が減少したことや、特別損失として海外における事業構造改善費用を計上したことなどから、前連結会計年度の731百万円の利益から5,054百万円の損失となりました	0
カーエレクトロニクスの売上高は、前連結会計年度に比べ12.7％減収の312,489百万円となりました	0
市販事業は減収となりました	0
カーオーディオは、北米を中心に海外で減少したことから減収となりました	0
カーナビゲーションシステムは、中国で増加しましたが、国内や北米で減少したことから減収となりました	0
ＯＥＭ事業は減収となりました	0
カーオーディオは、国内で増加しましたが、北米を中心に海外で減少したことから減収となりました	0
カーナビゲーションシステムは、北米で増加しましたが、国内や新興国で減少したことから減収となりました	0
国内外別の売上高については、国内は7.8％減収の123,631万円、海外は15.6％減収の188,858百万円となりました	0
その他の売上高は、ＦＡ機器の増加はありましたが、ホームＡＶや光ディスクドライブ関連製品の減少に加え、円高の影響もあり、前連結会計年度に比べ19.2％減収の74,193百万円となりました	0
国内外別の売上高については、国内は18.2％減収の39,083百万円、海外は20.2％減収の35,110百万円となりました	0
営業損益は、原価率は良化しましたが、売上高が減少したことから、前連結会計年度の144百万円の損失から780百万円の損失となりました	0
大口顧客への出荷が減少し、前期の売上高を3.6％下回りました	0
埼玉県狭山市の貸店舗の契約満了に伴う解約（当該土地及び建物は平成29年３月30日売却済み）により、当事業の売上高は213百万円（前期比19.4％減）、セグメント利益は107百万円（前期比32.9％減）となりました	0
事務機部品等の機構品分野においては営業活動を強力に推し進めましたが伸び悩む状況となりました	0
売上高は３億30百万円（前年同期比32.3％減）と大幅減収となりました	0
工場経費を中心とした徹底的な原価低減を進めましたが、セグメント損失は23百万円（前年同期は８百万円の損失）となりました	0
利益面につきましては、研究開発費を増加させたことにより、営業利益は27億７千５百万円（同8.9％減）、経常利益は27億９千万円（同18.6％減）となりました	0
また、前連結会計年度に発生いたしました特別利益（固定資産の売却益）の減少等により、親会社株主に帰属する当期純利益は20億７千３百万円（同37.2％減）となりました	0
しかし、他社との価格競争の厳しさが増したことで販売単価が下落し、売上は減少いたしました	0
ケア市場につきましては、新築では当社の納入時期にあたる病院着工件数は前期から減少いたしましたが、病院及び高齢者施設並びに高齢者住宅への積極的な営業活動を推進し、販売は前期並みとなりました	0
しかし、為替の影響により、円換算した売上高は34億７百万円（前連結会計年度比6.4％減）、営業利益は６千万円（同27.7％減）となりました	0
当連結会計年度におきましては、為替の影響等により売上高は72億７千万円（前連結会計年度比6.3％減）、営業利益２億１千万円（同14.9％減）となりました	0
シンガポールの販売子会社であるアイホンＰＴＥ.につきましては、シンガポールにおける新築物件数が大幅に減少しており、リニューアル物件受注活動や業務市場での積極的な営業活動を行ってまいりましたが、着工戸数の減少に伴う集合住宅市場の販売の落ち込みが大きく影響し、販売は減少しました	0
一方、大学、官公立病院市場では厳しい経営環境を受けて設備投資の抑制や延期が見られ、前期実績を下回りました	0
また、中南米は、中南米地域の販売組織再編に伴う商流変更（※）もあり、前期実績を下回りました	0
欧州では、ドイツ、トルコが低調に推移し、減収となりました	0
この結果、海外売上高は前期比4.6％減の415億２千万円となりました	0
利益面では、円高の影響や売上構成の変化により売上原価率が上昇したことに加え、業容拡大に向けた人員の増強や研究開発投資により販管費が増加したことから、営業利益は前期比17.4％減の135億８千５百万円、経常利益は前期比12.8％減の140億５千３百万円、親会社株主に帰属する当期純利益は前期比13.0%減の91億４千９百万円となりました	0
一方、中国や新興国経済は、力強さを欠く状況が継続しました	0
これらの結果、当連結会計年度の売上高は100,401百万円と前期比8.6％の減収となりました	0
製品区分別売上高につきましては、電子機器用は、自動車向けコンデンサは堅調であったものの、家電機器・インバータ向けなどの売上が減少したことなどにより65,662百万円と前期比5.8％の減収となりました	0
電力・機器用及び応用機器は、装置品の売上が堅調に推移したものの、主として電力・機器用コンデンサの売上が減少したことなどにより11,434百万円と前期比3.5％の減収となりました	0
回路製品は、各種電源および家庭用蓄電システムの売上が減少したことなどにより22,544百万円と前期比17.8％の減収となりました	0
海外売上高につきましては、アジアにおいて家電機器向けなどの売上が減少したことなどにより前期比9.3％の減収となりました	0
また、国内市場については、自動車関連機器向けの売上が堅調に推移しましたが、家庭用蓄電システムなどの回路製品が減少したことにより前期比7.6％の減収となりました	0
国内においては、自動車関連機器向けの売上が堅調に推移しましたが、家庭用蓄電システムなどの回路製品が減少したことににより、売上高は44,135百万円と前期比7.0％の減収となりました	0
営業損失につきましては、売上高の減収に加え、積極的な研究開発などにより売上高販売管理費比率が増加したことから157百万円(前連結会計年度は1,816百万円の営業利益)となりました	0
アジア地域においては、家電機器向け需要が低調となったことなどにより、売上高は41,776百万円と前期比10.2％の減収となりました	0
営業利益につきましては、売上高の減収などにより2,950百万円と前期比1.9％の減益となりました	0
当連結会計年度のエレクトロニクス業界の状況につきましては、普及拡大が一段落するスマートフォンや製品単価の低下等による薄型テレビの市場の縮小が影響し、電子部品・デバイスの世界生産も減少しました	0
この結果、当社グループの業績は、売上高につきましては、前年同期比4.3％減少して44億８千４百万円となり、損益につきましては、売上高の減少及び販売価格の下落により、営業損失３億２千２百万円、経常損失３億６百万円となりました	0
