半導体分野は、為替が影響したものの、産業分野及び情報電源分野において需要回復が進み、自動車分野も堅調に推移したことから、売上高、営業損益ともに前連結会計年度を上回りました	1
店舗流通分野は、コンビニエンスストア向け店舗設備機器及び自動釣銭機等の需要増加により、売上高は前連結会計年度を上回りましたが、機種構成差等により、営業損益は前連結会計年度を下回りました	1
当連結会計年度における当社グループを取り巻く経営環境は、米国は個人消費の持ち直しなどにより回復基調となり、中国や東南アジア諸国では景気鈍化の影響が見られたものの、年度後半には一部に復調の兆しが見られました	1
国内においては、民間設備投資がおおむね回復基調で推移し、輸出の持ち直しなどによる企業収益の改善も見られましたが、公共投資は年度後半に力強さを欠き、総じて緩やかな回復にとどまりました	1
その結果、受注高は932億24百万円（前連結会計年度比16.4％増）、売上高は842億28百万円（同5.2％増）となりました	1
損益面につきましては、営業利益は52億21百万円（同18.4％増）、経常利益は54億42百万円（同28.6％増）となり、親会社株主に帰属する当期純利益は39億77百万円（同39.5％増）となりました	1
航空宇宙部門において大型案件が獲得できたことやプリンタ部門ではアミューズメント向けの新製品投入、大型搬送システム部門において空港支援車両の更新需要を獲得できたこと等により、事業全体では、受注高は382億11百万円（前連結会計年度比26.3％増）、売上高は339億９百万円（同15.3％増）となりました	1
また、損益面につきましては、営業利益は11億87百万円（同83.3％増）となりました	1
クリーン搬送機器部門において半導体業界の堅調な設備投資を背景に半導体製造装置用機器が増加したこと、産業インフラ部門において大型案件が獲得できたこと、社会インフラシステム部門において官公庁向け電気設備更新が堅調に推移したこと等により、事業全体では、受注高は354億90百万円（前連結会計年度比7.6％増）、売上高は322億88百万円（同2.6％増）となりました	1
また、損益面につきましては、営業利益は28億75百万円（同11.1％増）となりました	1
当連結会計年度における世界経済は、先進国を中心に総じて緩やかな回復基調が続きました	1
米国では、企業部門も改善傾向にあり、個人消費を中心にした内需も底堅く推移しており、回復基調が持続しました	1
欧州では、消費を中心とした緩やかな回復基調が持続しました	1
新興国経済は、中国では減速のペースがやや弱まり、他の新興国については持ち直しの動きが見られました	1
一方、わが国経済は、企業収益に改善の動きが見られ、個人消費も回復の動きがあり、総じて緩やかな回復基調の動きとなりました	1
船舶用システム製品（船舶用配電制御システム等）は、前年同期と比べ海外造船向けの大型タンカー、国内造船向けのばら積運搬船の売上が減少しましたが、国内、海外造船向けコンテナ船のシリーズ船、陸電供給システムなどの売上があり、売上が前年同期に比べ若干増加しました	1
医療関連機器製品は、医療機器については、堅調に推移し、臨床検査機器についても、新製品が予定どおりに展開し、既存製品も堅調に推移しました	1
その結果、医療関連機器製品全体では、売上は前年同期に比べ増加しました	1
その結果、システム製品全体の売上は前年同期に比べ増加となりました	1
機器製品（低圧遮断器等）は、マレーシア国内向け及び他の地域向けでも一定量の売上がありましたが、船舶向けの売上が低調に推移したことにより、売上は前年同期に比べ減少しました	1
当連結会計年度における世界経済は、米国においては、雇用情勢の改善や米国大統領選挙後の内外需要回復を背景に緩やかな景気拡大が続きました	1
欧州においては、英国のEU離脱決定による先行きに不透明感があるものの、下期にかけて堅調に景気が回復しました	1
わが国においては、雇用情勢が堅調に推移し、緩やかな景気回復が見られました	1
このような厳しい経営環境の中で、中間期は減収減益を余儀なくされましたが、通期では中国向け環境用水質分析計をはじめとする海外輸出の大幅な増進に加えて、医療関連機器を含む計測機器事業全般が回復し増収となりました	1
利益面では、主たる計測機器事業の増収と生産合理化効果で不動産賃貸事業の減益をカバーできたことで営業利益は微減、経常利益は増加、加えて、前述の賃貸用不動産として所有しておりました狭山市の土地及び建物の売却益を計上したことにより、親会社株主に帰属する当期純利益は平成12年10月の合併以来最高となりました	1
以上の結果、当連結会計年度の売上高は14,445百万円（前期比0.8％増）、営業利益は1,365百万円（前期比0.1％減）、経常利益は1,426百万円（前期比0.6％増）、親会社株主に帰属する当期純利益は1,226百万円（前期比31.7％増）となりました	1
当事業の売上高は14,232百万円（前期比1.2％増）、受注高は14,635百万円（前期比4.2％増）、セグメント利益は2,095百万円（前期比5.5％増）となりました	1
国内市場では全般的に減収傾向ではあるものの、積極的に受注展開した海外市場では中国向け環境用水質分析計が大幅に増進したため増収となりました	1
これらの結果、環境・プロセス分析機器全体の売上高は前期を1.5％上回りました	1
ラボ用分析機器はHACH製品が増加し、ポータブル分析計は微増となりました	1
また医療関連機器はOEM供給拡大効果で増加し、科学分析機器全体の売上高は前期を2.8％上回りました	1
④電極・標準液及び⑤保守・修理の売上高は微増、⑥部品・その他は微減となりました	1
当連結会計年度におけるわが国経済は、個人消費や企業の設備投資は引き続き弱含みで推移しているものの、企業業績や雇用情勢の改善が続き、穏やかな回復基調で推移いたしました	1
物流産業資材では、当期においても雨水貯留浸透漕製品の需要は継続しております	1
その結果、当連結会計年度における売上高は153億67百万円（前年同期151億53百万円、1.4％増）となりました	1
また販売管理費につきましては、特に運賃・梱包費を管理対象として徹底的に抑制に努めました結果、営業利益は12億79百万円（前年同期７億９百万円、80.3％増）となりました	1
経常損益につきましては、営業外収益に為替差益、営業外費用に支払利息を計上したこと等により、経常利益は12億71百万円（前年同期５億89百万円、115.6％増）となりました	1
最終損益につきましては、特別損失に投資有価証券売却損１億75百万円を計上したこと等により、親会社株主に帰属する当期純利益は９億64百万円（前年同期４億50百万円、113.8％増）となりました	1
自動車部品は、新型車の量産開始に伴い売上高は堅調に推移いたしました	1
物流産業資材は民間大規模開発等により雨水貯留浸透漕製品の売上は好調に推移いたしました	1
その結果、売上高は146億14百万円（前年同期比2.6％増）、セグメント利益につきましては、徹底した原価低減、販売管理費の削減等により、９億72百万円（前年同期比150.0％増）となりました	1
売上高は４億22百万円（前年同期は４億22百万円）、セグメント利益は３億29百万円（前年同期比0.3％増）となりました	1
当連結会計年度におけるわが国の経済は、政府の経済政策の効果を背景に、企業収益の回復や雇用情勢の改善に伴い個人消費が持ち直すなど緩やかな景気回復基調が続きました	1
当社グループを取り巻く環境につきましては、日本国内におきまして、新築住宅着工戸数は底堅く推移いたしました	1
またインターホン設備等の更新需要も増加いたしました	1
海外市場におきましては、米国では業務市場を中心に引き続きセキュリティニーズが高く、好調に推移いたしました	1
当連結会計年度の経営成績は、売上高438億５千４百万円（前連結会計年度比2.8％増）となりました	1
国内の住宅市場につきましては、戸建住宅におきまして当社の納入時期にあたる住宅着工戸数が前期を上回り、テレビドアホンの主力モデルの販売台数は増加いたしました	1
集合住宅につきましては、新築では当社の納入時期にあたる住宅着工戸数が主に賃貸住宅の増加によって前期を上回る状況の中、発売以来好評をいただいている小規模マンション・アパート向けシステムの積極的な営業活動により、販売が好調に推移いたしました	1
また既設物件のリニューアルにおきましても分譲物件を中心に継続的な提案活動を行ってきたことにより受注が順調に推移するとともに、専任の営業担当を置き受注活動を強化した賃貸住宅への小規模マンション・アパート向けシステムの販売が好調に推移いたしました	1
この結果、集合住宅の売上が戸建住宅の売上減少分をカバーし、住宅市場全体の売上は増加いたしました	1
一方、リニューアルにおきましては新型ナースコールシステムを中心としたリニューアル提案活動を病院や高齢者施設に対して積極的に行ってきたことにより、その機能性等を高く評価いただき、販売は増加いたしました	1
この結果、ケア市場全体といたしましては、リニューアルにおける販売の増加により、売上は増加いたしました	1
これらの結果、売上高は398億２百万円（前連結会計年度比3.5％増）、営業利益は23億５千２百万円（同5.3％増）となりました	1
アメリカの販売子会社であるアイホンコーポレーションにおきましては、業務市場におきまして官公庁施設に対するテレビドアホン等の納入が継続し、販売が増加いたしました	1
また、オフィスや大規模施設等への提案活動が功を奏し、ＩＰネットワーク対応インターホンシステムを中心とした販売が好調に伸張いたしました	1
また住宅市場では、セキュリティニーズの高まりと積極的な営業活動が、大型プロジェクト物件の受注や新型集合住宅向けシステムの好調な販売につながり、売上の増加に寄与しました	1
これらの結果、現地通貨ベースにおける売上は増加いたしました	1
また、円換算した売上高は68億３千３百万円（前連結会計年度比3.4％増）、営業利益は１億６千７百万円（同31.7％増）となりました	1
フランスの販売子会社であるアイホンＳ.Ａ.Ｓ.におきましては、緩やかな回復基調は見られるものの低調な推移が続く欧州経済の中、戸建住宅向けテレビドアホンの販売が、積極的な営業活動により前期から引き続き好調に推移いたしました	1
また集合住宅では１月に市場導入し、高い評価を得ている新型集合住宅向けシステムの販売が好調に推移いたしました	1
また業務市場におきましてもセキュリティニーズを背景としたＩＰネットワーク対応インターホンシステムやテレビドアホン等の積極的な営業活動により、オフィスやショッピングモール、また公共施設を中心に販売が好調に推移いたしました	1
イギリスの販売子会社であるアイホンＵＫにおきましては、集合住宅市場及び業務市場向けの販売が前期を上回りました	1
これらの結果、現地通貨ベースにおける売上は増加いたしました	1
当連結会計年度におきましては、売上高は25億２千万円（前連結会計年度比22.7％増）、営業利益は９千５百万円（同2.8％増）となりました	1
オーストラリアの販売子会社であるアイホンＰＴＹにつきましては、大型物件を対象とした積極的な受注活動が功を奏し集合住宅向けシステムの受注が好調に推移し、販売は増加いたしました	1
中国の販売子会社である愛峰（上海）貿易有限公司につきましては、病院及び高齢者施設に対する積極的な営業により、販売は増加いたしました	1
また業務市場におきましても高速道路等でのＩＰネットワーク対応インターホンシステムへの取替え活動が功を奏し、販売増加に寄与いたしました	1
当連結会計年度におけるわが国経済は、企業収益や雇用環境など底堅く推移しているものの、英国のEU離脱等欧州の政治リスクや米国の政策動向の影響をはじめとした世界経済の不確実性などから、先行き不透明な状況が続きました	1
これらの結果、当連結会計年度における当社グループの業績につきましては、売上高は875億86百万円（前年同期比25.1％増）、営業利益は17億87百万円（前年同期比173.4％増）、経常利益は20億14百万円（前年同期比165.0％増）、親会社株主に帰属する当期純利益は17億７百万円（前年同期は親会社株主に帰属する当期純損失15億55百万円）となりました	1
ポストプロダクションにおきましては、各分野とも受注は堅調に推移し、また、IP配信事業者からのエンコード作業等の受注が増加したこと、及び売上原価削減の効果により、前期の実績を上回りました	1
この結果、当連結会計年度における当該事業分野の業績は、売上高は156億９百万円（前年同期比4.7％増）、営業利益は12億28百万円（前年同期比25.9％増）となりました	1
当連結会計年度よりアニメーション制作の株式会社オー・エル・エム及びその子会社２社が新たに当事業セグメントに加わったことにより、売上・利益とも大きく増加しました	1
また、既存のCM、映画制作分野等、各種コンテンツにおいて堅調に受注を獲得しました	1
この結果、当連結会計年度における当該事業分野の業績は、売上高は215億60百万円（前年同期比75.0％増）、営業利益は10億８百万円（前年同期比115.6％増）となりました	1
放送分野の「イマジカBS」「歌謡ポップスチャンネル」におきましては、加入者数、売上とも堅調に推移するとともに、番組販売、DVD/Blu-rayの販売が収益に貢献しました	1
イメージング分野におきましては、期中に進行した円高が主力の高速度デジタルビデオカメラ等の欧米への輸出額に影響を与えたものの、国内の堅調な受注やアジアでの好調により、前期並みの実績となりました	1
プロ用映像機器分野におきましては、大型案件の受注に加え、４K・８K対応案件等の確実な獲得により前期の実績を上回りました	1
この結果、当連結会計年度における当該事業分野の業績は、売上高は139億76百万円（前年同期比15.8％増）、営業利益は13億38百万円（前年同期比8.2％増）となりました	1
人材派遣・請負サービス分野におきましては、主力の派遣事業がほぼ前期並みに推移する一方で、人材紹介事業やゲーム制作受託、デバック作業の案件が堅調で、また新規連結子会社も好調に推移いたしました	1
体制強化に伴う販売費・一般管理費において一時的な費用の発生もあり営業損失を計上いたしましたが、当初計画に比べ売上、利益ともに改善しております	1
この結果、当連結会計年度における当該事業分野の業績は、売上高は216億58百万円（前年同期比32.3％増）、営業損失は11億61百万円（前年同期は営業損失15億35百万円）となりました	1
b.売上高250億円、営業利益25億円の過去最高業績	1
業績は、上期には円高や特殊要因(車載用コネクタの商流変更)による押し下げ要因があったものの、下期からの国内外での設備投資の活況を受けFA分野が堅調に推移したことにより、売上高は172億５百万円(前年同期比0.5％増)となり、また営業利益も体質強化の取組みにより、14億25百万円(同9.5％増)と、ともにITバブル崩壊があった2001年以降で最高となりました	1
また、経常利益は14億76百万円(同19.3％増)、親会社に帰属する当期純利益は、当連結会計年度の業績および今後の業績動向を踏まえ回収可能性がある部分について繰延税金資産を計上した結果、15億42百万円(同13.0％増)と上場来最高となりました	1
業績は、車載カメラ用コネクタの市場拡大やFA分野の回復により、堅調に推移していますが、上期の円高や特殊要因(車載用コネクタの商流変更)による押し下げ要因があったため、売上高は146億41百万円(前年同期比0.3%減)となりました	1
一方、車載分野の実質的な増販が為替調整分を上回ったため、セグメント利益は12億82百万円(同9.6%増)となりました	1
クラウド技術を生かした高付加価値案件の獲得により伸長し、売上高は26億43百万円(前年同期比5.7%増)、セグメント利益は1億42百万円(同8.3%増)になりました	1
国内市場においては、急性期病院、中小病院、診療所といった市場別の取り組みを強化するとともに、消耗品・保守サービス事業の拡大に注力した結果、売上を伸ばすことが出来ました	1
市場別には、私立病院市場が診療報酬改定への対応の影響もあって好調に推移したほか、診療所市場での売上も大幅に伸長しました	1
この結果、国内売上高は前期比2.3％増の1,247億６千４百万円となりました	1
中国も現地通貨ベースでは堅調に推移しました	1
その他地域では、アフリカ諸国での販路開拓が奏功し、エジプトで大口商談を受注するなど、売上が大幅に伸長しました	1
これらの結果、当連結会計年度の売上高は前期比0.5％増の1,662億８千５百万円となりました	1
当連結会計年度におけるわが国経済は、年央は為替が円高で推移したものの、堅調な輸出に支えられ、緩やかな回復基調が続きました	1
海外においては、米国経済は、好調な企業業績に加えて、個人消費も底堅く推移し、緩やかな拡大基調が続きました	1
欧州経済は、英国のEU離脱採択の影響は限定的であったことなどにより、景気は回復基調となりました	1
また、エネルギー、環境関連分野への関心の高まりを受け、環境関連市場は引き続き堅調に推移しました	1
また、利益につきましては、営業利益は3,019百万円と前年同期比36.8％の減益、経常利益は為替差益が930百万円発生し4,750百万円と前期比9.5％の増益、親会社株主に帰属する当期純利益は2,623百万円(前連結会計年度は591百万円の親会社株主に帰属する当期純損失)となりました	1
営業損失は、販売管理費の削減などにより92百万円(前連結会計年度は193百万円の営業損失)となりました	1
営業利益につきましては、コスト削減を継続的に推進したことなどにより195百万円と前期比109.0％の増益となりました	1
タンタルコンデンサ事業につきましては、車載用レーダー装置等のカーエレクトロニクス向け及び家庭用火災報知器向けの需要は増加しましたが、スマートフォン向けの需要が減少しました	1
回路保護素子事業につきましては、車載用回路保護素子は増加したものの、リチウムイオン電池向けの高電流ヒューズの売上高が減少しました	1
セグメント利益は、１千６百万円（前年同期比10.6％増加）となりました	1
当期における当社グループを取り巻く事業環境につきましては、米州における設備投資需要は堅調に、国内および欧州においては概ね横ばいに、それぞれ推移しました	1
中国およびその他のアジアにおいては、期の終わりごろから回復傾向が見られるようになりました	1
また当期におきましては、安全柵なしで人とロボットが協働して作業可能な緑のロボット「ファナック ロボット CR-35i A」が、財団法人大河内記念会より「協働ロボットと人の協働作業による高効率組立システム」として平成28年度大河内記念生産賞を受賞しました	1
ＣＮＣシステムの主要顧客である工作機械業界は、欧州などにおいて依然として厳しい状況が続いたものの、期の初めにおける中国での一時的な需要の増加に加え、期の終わりごろから中国その他のアジアにおいて全般的に回復傾向が見られるようになりました	1
国内においては堅調に推移しました	1
これらにより、当社グループのＣＮＣシステムの売上高は前年度に比べ増加しました	1
ＦＡ部門の連結売上高は、1,750億16百万円（前期比2.8％増)、全連結売上高に対する構成比は32.6％となりました	1
ロボットにつきましては、米州および欧州においては、期前半に自動車産業等において設備投資の谷間があったものの、高原状態が続きました	1
中国においては需要の伸びが顕著でした	1
国内においても自動車産業向けを中心に好調でした	1
ロボット部門の連結売上高は、1,900億43百万円（前期比0.9％増)、全連結売上高に対する構成比は35.4％となりました	1
ロボドリル（小型切削加工機）につきましては、自動車、二輪車の部品加工向けの販売が堅調に推移し、また、第４四半期からＩＴ関係の一時的需要が動き始めました	1
当連結会計年度におけるわが国経済は、雇用や所得環境の改善が続き、設備投資等にも持ち直しの動きが見られるなど景気は緩やかな回復傾向のうちに推移しました	1
また、海外経済においては、英国のＥＵ離脱や米国大統領選等の影響により不透明な部分があったものの、米国景気が緩やかに回復し、中国を始めとするアジア地域にも持ち直しの動きがみられました	1
また、ＪＲ東海から当期受領した補償金36億94百万円を特別利益に計上し、また、プリント配線板事業の移管に係る費用等17億76百万円を特別損失に計上したことから、親会社株主に帰属する当期純利益は前期比13億95百万円改善の15億10百万円となりました	1
セグメント利益は、プロダクトミックスの変動による利益の増加及び諸経費の削減に努めた結果、改善しました	1
セグメント利益は、前期比１億84百万円改善の５億６百万円となりました	1
一方、社会インフラ領域でのソフトウェア開発や、自動車関連での組込み系システム開発の需要、メーカーをはじめ広い領域での業務用アプリケーションの開発需要は増加傾向にあります	1
以上の結果、当連結会計年度における売上高は3,319,663千円と前連結会計年度と比べ167,844千円(5.3％)増加しました	1
営業利益は243,588千円（前連結会計年度は営業損失22,403千円）となり、経常利益は249,590千円（前連結会計年度は経常損失17,684千円)となりました	1
