当社グループを取り巻く環境は、実質賃金が伸び悩むなか、消費者の皆様の生活防衛意識の高まりや節約志向により、個人消費は本格的な改善には至らず、また少子高齢化、人口減少による社会構造の変化、雇用改善に伴う労働コストの上昇、企業間競争の激化など、引き続き厳しい状況となりました	0
春から夏にかけましては個人消費の低迷などにより、きのこの価格は厳しい状況で推移いたしました	0
台湾の現地法人「台灣北斗生技股份有限公司」におきましては、ブランドの構築、企画提案などに力を入れ販売活動を行ってまいりましたが、企業間競争の激化により厳しい状況で推移いたしました	0
化成品事業におきましては、引き続き厳しい販売環境にありましたが、中核である包装資材部門におきましては、効率化・利益率の改善を図るため営業戦略を見直し、販売強化に注力してまいりました	0
以上の結果、化成品事業の売上高は92億45百万円（同1.7％減）となりました	0
当連結会計年度におけるわが国経済は、景気は緩やかな回復基調が継続しているものの、個人消費には未だ力強さがなく、さらに英国のＥＵ離脱問題や米国のトランプ新政権発足の影響により海外経済の不確実性が高まるなど、景気の先行きについては依然不透明な状況にあります	0
一方、水産・食品業界におきましては、消費マインドの低迷により、厳しい経営環境が続いております	0
食品製造販売部門においては、取引先の見直し等により、売上高は昨年を下回りましたが、原料価格が低下したことと、販売経費の削減により、所定の利益を確保することができました	0
この結果、売上高は、前連結会計年度に比べ142億円（3.2%）減少の4,363億円となりました	0
これにより、売上高は前連結会計年度に比べて減少しました	0
一方、中国およびその他の新興国における需要が低調であったことから、全体として販売量は減少しました	0
一方、ITOの主要原料であるインジウムの価格が下落したことから販売価格が低下し、売上高は前連結会計年度に比べて減少しました	0
国内の亜鉛メッキ鋼板向け需要は、自動車向けが低調に推移したこと等から減少しました	0
金・銀ともに前期に比べ国際相場は上昇したものの、為替相場は円高となったことから、国内価格は同水準となり、売上高は前連結会計年度に比べて微減となりました	0
一方、海外においては、新興国経済の減速、米国新政権の政策の不確実性などの影響が懸念され、景気の先行きについては、依然として不透明な状況が続いております	0
その結果、同事業の当連結会計年度の売上高は、販売数量の増加があったものの、円ベースの原料価格下落に伴う販売価格の低下により、前年度比505百万円減収（8.1％減収）の5,734百万円となりました	0
このような状況のもと、当社グループの業績は、主力のコークス事業において、原料炭価格上昇の影響や、販売数量の増加などがあったものの、燃料販売事業で販売価格の下落などがあり、当期の連結売上高は、前期比34億５千２百万円減少の890億５千１百万円となった	0
利益については、コスト削減の取り組みによる成果や、原料炭価格上昇に伴う時差影響による好転などがあったものの、原材料および製品の評価減などがあり、微減となった	0
燃料販売事業については、既存商権の維持に加え、新規の顧客開拓に取り組み、当社グループの販売数量は、176万８千トン（前期比１万６千トン増加）となったが、販売価格の下落などがあり、減収となった	0
この結果、燃料販売事業の連結売上高は、216億２千８百万円（前期比40億８千万円減少）となり、連結営業利益は、17億７百万円（前期比３千８百万円減少）となった	0
産業機械事業については、大口ユーザー向けの大規模定修工事が隔年受注であり、今年度は発生しないことなどにより、減収減益となった	0
このような状況において、スパリゾートハワイアンズにつきましては、日帰り・宿泊ともに利用者数は減少	0
下落等により営業利益は11億１百万円（前期比７億20百万円、39.5％減）、経常利益は７億89百万円（前期比７億30百万円、48.1％減）、親会社株主に帰属する当期純利益は、固定資産（投資不動産）にかかる減損損失10億39百万円を計上したものの、繰延税金資産の計上及び減損損失等に伴う繰延税金負債取崩しによる法人税等調整額（△は	0
各イベントが昨年の50周年記念事業及び太平洋・島サミット開催の話題性による集客効果には及ばず、利用人員は1,411千人（前期比61千人、4.2％減）となりました	0
価格高騰による団体旅行の減少に加え、11月に発生した福島県沖地震の影響によるキャンセルの発生及びその後の	0
予約減少もあり、利用人員は469千人（前期比11千人、2.4％減）となりました	0
ゴルフパック利用が減少したものの、地元圏の集客は堅調に推移し、利用人員は58千人（前期比０千人、1.1％減）となりました	0
この結果、日帰り・宿泊両部門の利用者数の減少等により、当部門の売上高は、126億71百万円（前期比７億91百万円、5.9％減）となり、消費単価の下落や人件費の増加等により、営業利益は15億99百万円（前期比５億32百万円、25.0％減）となりました	0
卸売部門につきましては、電力会社向け販売数量は増加したものの販売価格が下落するなど弱含みにて推移	0
国内、中国及び北米の需要減に伴い、船舶用及び産業用モーターの販売数量の減少により減収となりました	0
この結果、当部門の売上高は15億７百万円（前期比２億71百万円、15.3％減）、売上減及び円高の影響等により	0
営業利益は１億２百万円（前期比１億23百万円、54.7％減）となりました	0
につきましては、販売数量が減少するとともに販売単価も下落する等厳しい状況のなかで大幅な減益となりました	0
この結果、当部門の売上高は、17億61百万円（前期比１億10百万円、5.9％減）、販売単価の下落等により営業	0
利益は20百万円(前期比61百万円、74.8％減)となりました	0
農業用肥料の販売が減少したことにより、売上高は20億41百万円(同1.2％減)となり、営業利益は43百万円(同53.2％減)となった	0
当社グループを取り巻く事業環境は、機械関連については、舶用機器の需要は、国内造船所における過年度までの豊富な受注残の下支えがあるものの、新造船の新規受注低迷の影響を受け弱含みに推移いたしました	0
資源関連については、住宅関連資材向け需要並びに、半導体、情報関連分野の需要とも、弱含みに推移したものの、年度後半には回復の兆しも見られました	0
この結果、当連結会計年度の売上高は93億６千万円（前連結会計年度比4.4％減）、営業利益は４億３千３百万円（同0.3%減）、経常利益は４億７千２百万円（同10.6％増）となり、また、特別損失として資源関連事業の結晶質石灰石部門に関する減損損失１億８千３百万円を計上したこと等から、親会社株主に帰属する当期純利益は１億７千９百万円（同21.9％増）となりました	0
舶用機器は、新造船の新規受注低迷を受けての造船所の建造ペースの減速の影響等により売上、受注とも減少いたしました	0
産業機器は、売上は、空気予熱機関連が増加したものの、製鉄関連が減少し、全体ではやや減少いたしました	0
受注は、重電関連が増加したものの、製鉄関連の大型案件の一巡や設備工事関連の減少等により、減少いたしました	0
また、砂利、砂等の土木建設資材の取り扱いもやや減少いたしました	0
この結果、資源関連事業全体では、売上高は20億５千万円（前連結会計年度比5.6％減）、営業損失は２億１千４百万円（前連結会計年度は営業損失２億４千３百万円）となりました	0
耐熱塗料の売上は、設備用に加え、OA機器向け輸出仕様品等工業用も低調に推移し、減少いたしました	0
また、ライナテックス（高純度天然ゴム）関連の売上も、セメント業界向け大型案件の一巡で減少し、この結果、素材関連事業全体では、売上高は６億４千２百万円（前連結会計年度比16.1％減）、営業利益は２百万円（同96.0%減）となりました	0
経常利益は、営業外収益に受取利息１億82百万円を計上したものの、営業外費用に為替差損１億53百万円及び支払利息１億64百万円を計上したことなどにより、９億59百万円と前年同期比４億20百万円（30.5%）の減益となりました	0
売上高は、石炭販売分野における石炭価格の下落及び販売数量の減少などにより356億19百万円と前年同期比77億76百万円（17.9%）の減収となり、セグメント利益は、石炭生産分野における石炭価格の下落などにより10億23百万円と前年同期比３億55百万円（25.8%）の減益となりました	0
売上高は前期比5.3％減の2,395億円余となった	0
セグメント利益は、海外工事の完成工事利益率の悪化により、前期比21.9％減の52億円余となった	0
不動産事業を中心に展開しており、売上高は前期比91.8％減の16億円余となり、セグメント利益は前期比0.9％減の４億円余となった	0
このような状況のもと，当社グループの売上高は，完成工事高の減少などにより，前連結会計年度に比べ5.9％減少し１兆5,674億円となった	0
当社が営んでいるエンジニアリング事業や子会社が営んでいる各種事業の売上高は，前連結会計年度に比べ1.2％減少し4,729億円となり，セグメント利益は前連結会計年度に比べ3.6％減少し189億円となった	0
建設事業受注高は、前連結会計年度と同水準で推移し、前連結会計年度比3.8％減の１兆7,283億円（前連結会計年度は１兆7,958億円）となった	0
完成工事高は、前連結会計年度と同水準で推移し、前連結会計年度比3.6％減の2,968億円（前連結会計年度は3,079億円）となった	0
売上高は、前連結会計年度と同水準で推移し、前連結会計年度比0.9％減の3,611億円（前連結会計年度は3,646億円）となった	0
営業利益は、前連結会計年度と概ね同水準で推移し、前連結会計年度比5.1％減の195億円（前連結会計年度は206億円）となった	0
売上高については、建設事業1,092億円(前連結会計年度比3.1％減)に不動産事業16億円（前連結会計年度比28.8％減）を加えた1,109億円(前連結会計年度比3.6％減)となった	0
受注高については、建築工事89,418百万円（前連結会計年度比17.5％増）、土木工事31,380百万円（前連結会計年度比36.3％減）の合計120,799百万円（前連結会計年度比3.6％減）となり、完成工事高は、建築工事75,090百万円（前連結会計年度比9.9％減）、土木工事34,164百万円（前連結会計年度比16.4％増）の合計109,255百万円（前連結会計年度比3.1％減）、営業利益は3,492百万円（前連結会計年度比3.4％減）である	0
売上高は1,665百万円（前連結会計年度比28.8％減）、営業利益は629百万円（前連結会計年度比50.5％減）である	0
当事業年度におけるわが国経済は、政府による経済政策や金融政策の総動員もあり、緩やかな回復基調となったものの、個人消費や設備投資は力強さを欠き、海外経済の減速と為替、原材料価格の変動リスクを抱え、先行き不透明な状況が続いた	0
しかし、依然として工事従事者の不足による工事着工遅れ等の問題があり、仮設業界全体では厳しい状況が続いた	0
このような状況の中、当事業年度の業績はリース業者の買い控えと工事着工遅れが想定を上回り、製造受託の逸注も重なって、売上高59億７千８百万円（前期比30.2％減）となった	0
損益面では各セグメントの売上高減少と賃貸部門の粗利率の低下により、営業利益１億８千７百万円（前期比63.0％減）、第三者割当増資に伴う株式交付費３千４百万円等で経常利益１億３千万円（前期比72.8％減）となった	0
当期純利益は、営業利益及び経常利益の減少に加え、損害補償損失引当金繰入額５千万円の計上により２千２百万円（前期比92.2％減）となった	0
仕入商品販売の減少と、リース業者の機材保有量の上昇による買い控えから主力製品の受注が減少し、売上高は25億４千９百万円（前期比20.0％減）と減収となった	0
セグメント利益は６千７百万円（前期比69.1％減）と減益となった	0
首都圏を中心とした再開発工事等により仮設機材の需要は底堅いが、人手不足や資材高騰による工事着工遅れ等で軽仮設機材の稼働は足踏み状態が続き、売上高は24億８千８百万円（前期比10.0％減）と減収となった	0
セグメント利益は減収による粗利率の低下により１億２千４百万円（前期比58.8％減）と減益となった	0
鉄骨部材製造受託の逸注及びくさび緊結式足場、高速道路用吊り足場のＯＥＭ製造の減少により、売上高は９億４千万円（前期比64.1％減）と減収となった	0
セグメント別の状況といたしまして、建築設備事業は、前連結会計年度を3.8％下回る1,466億1千2百万円となりました	0
機械システム事業は、前連結会計年度に大型搬送用設備を受注した影響等により、前連結会計年度を21.1％下回る81億3千万円となりました	0
セグメント別の状況といたしまして、建築設備事業は、1,415億6千7百万円と前連結会計年度と比較し、5.6％の減収となりました	0
機械システム事業は、受注高が減少したことにより、81億9千2百万円と前連結会計年度と比較し、11.1％の減収となり、環境システム事業は、182億7千1百万円と前連結会計年度と比較し、2.5％の減収となりました	0
利益面につきまして、営業利益は60億1千2百万円（前年同期比7.6％減）となりました	0
これは、原価管理の徹底や作業効率の向上等利益率改善に努めましたものの、減収に加え、退職給付に係る数理計算上の差異償却額の増加等が影響したことによるものであります	0
経常利益は68億8千万円（前年同期比15.4％減）、親会社株主に帰属する当期純利益は46億9千8百万円（前年同期比11.8％減) となりました	0
受注高は前連結会計年度を3.8％下回る1,466億1千2百万円、売上高は前連結会計年度を5.6％下回る1,415億6千7百万円、セグメント利益（経常利益）は前連結会計年度を16.8％下回る64億4百万円となりました	0
受注高は前連結会計年度を21.1％下回る81億3千万円、売上高は前連結会計年度を11.1％下回る81億9千2百万円、セグメント損失（経常損失）は1億3千8百万円（前連結会計年度はセグメント利益2億7千5百万円）となりました	0
売上高は前連結会計年度を7.9％下回る4億9千9百万円、セグメント利益（経常利益）は前連結会計年度を57.2％下回る2千2百万円となりました	0
一方、海外においては、米国新政権の発足、英国の欧州連合（ＥＵ）離脱問題、中国及びアジア新興国の景気低迷等、先行き不透明な状態が継続した	0
一方、当社グループが事業展開している東南アジアでは、経済成長率鈍化の影響等により日系企業の設備投資が減少し、建設需要は低調に推移した	0
受注高については、国内では堅調に推移したが、海外経済の減速や日系企業の投資減少の影響を受け、東南アジアにおける海外子会社で減少したことにより、前期より減少となった	0
売上高についても、海外子会社の受注高が減少した影響が大きく、前期より減少となった	0
利益面では、売上高減少の影響により、営業利益、経常利益は前期より減少となったが、親会社株主に帰属する当期純利益は法人税等の減少により前期より増加となった	0
事業の種類別では、設備工事業の受注高は1,342億94百万円（前期比4.5%減）、売上高は1,271億50百万円（同6.5%減）となり、機器販売を中心とするその他の事業では、受注高及び売上高は100億76百万円（同7.6%減）となった	0
一般電気工事部門は、国内では首都圏を中心に工事量が増加したが、大型太陽光案件の減少や、海外における建設需要が減少し、受注高は892億61百万円（前期比10.1%減）、売上高は862億28百万円（同13.0%減）となった	0
売上高は、工事に関する材料並びに機器の販売事業などが減少したことなどから、前連結会計年度に比べ18億88百万円減少（12.8％減）し、128億55百万円となった	0
売上高につきましては、前連結会計年度比1.3％減の783億87百万円となりました	0
売上高は32億75百万円（前連結会計年度比0.2％減）、営業利益は3億83百万円（前連結会計年度比1.6％減）となりました	0
当社グループの主要な事業領域であります情報通信分野におきましては、光アクセス等の固定系通信工事が減少する一方、光コラボレーションモデルによる新たなサービスの普及、クラウドサービス、ＩｏＴの急速な拡大等が着実に図られてきており、情報通信分野以外の公共・民需系分野におきましても、国土強靭化施策の推進や設備の老朽化対策に伴う社会インフラ投資の拡大等が期待されております	0
熊本地震などにより上期の受注は遅れましたが、受注高は63億３千７百万円（前期比0.8％増）、完成工事高は59億９千７百万円（前期比4.4％減）となりました	0
また、日銀の金融政策決定から生じた不安定な金融市場により、為替相場及び株式相場等は先行き不透明な状態が続きました	0
完成工事高は、前連結会計年度比13,092百万円減の125,253百万円となりました	0
当社グループの属する設備工事業界におきましては、堅調であった設備投資に低調な動きも見られ、熾烈な受注価格競争が続くなど、厳しい環境で推移しました	0
当セグメントにおいては、電気設備工事、建築・土木工事、並びに太陽光発電設備工事を行っており、受注高は184億円（前期比28.8％減）、売上高は222億円（前期比10.2％減）、営業利益は24億65百万円（前期比32.6％増）となりました	0
受注高、売上高は前期に電気設備工事の大型案件があったことから前期を下回りました	0
営業利益はタイ、ベトナムが低調に推移したことから前期を下回りました	0
しかしながら、資材費や労務費のコストが高止まりする中で、北海道・東北地区の集中豪雨の影響により、公共工事の優先順位が入れ替わり、当初予定されていた工期が先延ばしになるなど、当社を取り巻く経営環境は厳しい状況で推移しました	0
軽量盛土工事の受注高は、大型工事の受注により1,701百万円（前事業年度比22.6％増）と増加しましたが、空洞充填工事の受注高が628百万円（前事業年度比2.6％減）と減少し、また管路中詰工事の受注高も大型工事の発注が一段落したことから341百万円（前事業年度比64.8％減）と大幅に減少し、気泡コンクリート工事全体の受注高は2,671百万円（前事業年度比11.1％減）と減少いたしました	0
完成工事高につきましては、大型工事の施工時期のずれ込みにより、地盤改良工事の完成工事高は904百万円（前事業年度比10.0％減）と減少いたしました	0
売上高は、気泡剤や固化剤の販売など19百万円（前事業年度比17.3％減）となりました	0
当連結会計年度における我が国経済は、政府による継続的な景気対策や日銀の金融緩和策により、緩やかな景気回復基調が続きましたが、個人消費は足踏み状況が見られる他、英国のＥＵ離脱問題、中国を中心とする新興国経済の鈍化等、先行き不透明な状況が続いております	0
当業界におきましては、加工品の原料価格は比較的安定しておりましたが、食品全般に対する節約志向、低価格志向が高まる中、物流費の上昇や企業間の販売競争が激化し厳しい状況が続きました	0
当業界におきましては、砂糖の国内消費が８年ぶりに前年比増加したものの、粗糖相場の上昇と円安の進行により原料コストが上昇しており、消費者の節約志向も勘案すると今後の国内消費の動向には引き続き留意すべき状況にあります	0
ニューヨーク粗糖先物相場の期近限月は、１ポンド当たり15.40セントで始まり、タイ、インド及び中国の減産や最大の生産国であるブラジルの減産予測による５年ぶりの供給不足を背景とした先行き不透明感から上昇し、10月に期中最高値となる23.90セントをつけました	0
これらの結果、当連結会計年度の連結売上高は378,307百万円（前期比3.1％減）となりました	0
利益面においては、営業利益は37,281百万円（前期比6.9％減)、経常利益は49,370百万円（前期比2.5％減)、親会社株主に帰属する当期純利益は30,154百万円（前期比4.5％増）となりました	0
しかしながら、健康機能性飲料の売り上げが伸び悩み、ジュース・清涼飲料全体では前期を下回る結果となりました	0
これらの結果、飲料および食品製造販売事業部門（米州地域）の連結売上高は45,252百万円（前期比14.2％減）となりました	0
これらの結果、飲料および食品製造販売事業部門（アジア・オセアニア地域）の連結売上高は93,364百万円（前期比3.9％減）となりました	0
これらの結果、飲料および食品製造販売事業部門（ヨーロッパ地域）の連結売上高は7,800百万円（前期比9.5％減）となりました	0
しかしながら、昨年４月の薬価改定により、当社製品の薬価が大きく引き下げられており、苦戦を強いられました	0
これらの結果、医薬品製造販売事業部門の連結売上高は27,836百万円（前期比20.0％減）となりました	0
これらの結果、その他事業部門の連結売上高は19,951百万円（前期比1.8%減）となりました	0
「うちのごはん」は、さまざまなプロモーションやテレビ広告、店頭販促活動を行いましたが、そうざいの素市場低迷の影響もあり、前期を下回りました	0
この結果、部門全体としてはつゆ類の売上減が影響し、前期の売上を下回りました	0
本みりんは、「米麹こだわり仕込み本みりん」、料理酒は、「国産米こだわり仕込み料理の清酒」等の高付加価値品は順調に推移しましたが、一方でギフトや加工・業務用が振るわず、本みりん全体として前期を下回りました	0
輸入ワインは、低価格帯の商品が振るわず前期を下回りました	0
この結果、部門全体としては前期の売上を下回りました	0
天候不順の影響によりフィリピン産パイナップル缶詰の供給が不足し、主要市場である香港、中国をはじめとする全市場に影響し、前期の売上を下回りました	0
