我が国経済については、個人消費は足踏み状態が続いたものの、雇用・所得環境は改善傾向にあり、また、民間設備投資は年度後半に円安が進行したこと等により持ち直しの動きとなるなど、景気は緩やかな回復基調となった	1
国内建設市場においては、建設投資は首都圏を中心とする大規模再開発や交通インフラ整備等の需要に支えられて公共・民間ともに底堅さを維持し、労務需給は引き続き安定的に推移した	1
なお、当社の受注高は、開発事業等を含めて同9.1％増の１兆3,499億円（前連結会計年度は１兆2,368億円）となった	1
売上高は、前連結会計年度と同水準で推移し、前連結会計年度比4.5％増の１兆8,218億円（前連結会計年度は１兆7,427億円）となった	1
利益については、建設事業の利益率向上と開発事業等の好調な推移により売上総利益が増加したことを主因に、営業利益は前連結会計年度比39.9％増の1,553億円（前連結会計年度は1,110億円）となり、経常利益は同44.2％増の1,634億円（前連結会計年度は1,133億円）となった	1
親会社株主に帰属する当期純利益は、特別損益が改善したこともあり、前連結会計年度比45.0％増の1,048億円（前連結会計年度は723億円）となった	1
営業利益は、完成工事総利益率が向上したことから、前連結会計年度比24.8％増の359億円（前連結会計年度は288億円）となった	1
完成工事高は、前連結会計年度と同水準で推移し、前連結会計年度比1.3％増の8,351億円（前連結会計年度は8,240億円）となった	1
営業利益は、完成工事総利益率が向上したことを主因に、前連結会計年度比36.9％増の786億円（前連結会計年度は574億円）となった	1
販売物件の引渡しがあったことを主因に、売上高は前連結会計年度比110.8％増の718億円（前連結会計年度は340億円）、営業利益は同14倍超の98億円（前連結会計年度は６億円）となった	1
売上高は、前連結会計年度と概ね同水準で推移し、前連結会計年度比9.0％増の4,009億円（前連結会計年度は3,679億円）となった	1
営業利益は、売上総利益率が向上したことも加わり、前連結会計年度比55.7％増の116億円（前連結会計年度は75億円）となった	1
当連結会計年度における世界経済は、米国等においては雇用・所得環境の改善が続くなか、英国のＥＵ離脱問題や、新興国の景気減速、テロ・紛争等の地政学的リスク等の懸念があり、楽観視できない状況にある	1
当社の主な関連業界である建設及び住宅業界においては、民間設備投資が堅調に推移したことに加え、住宅投資や官公庁工事が増加した事もあり、業界全体の受注高は前年をやや上回る水準で推移した	1
利益面では価格交渉による粗利率の上昇や経費負担の減少もあり、セグメント利益１千２百万円（前期はセグメント損失５百万円）となった	1
当連結会計年度の我が国経済は、前半は円高や新興国経済の減速による企業収益の悪化から回復ペースが鈍化しておりましたが、後半は円安の進行や海外経済の回復を背景とした企業収益の改善を受けて持ち直しの動きが見られました	1
また、設備投資につきましても、慎重姿勢は残るものの緩やかな回復基調にあります	1
建設投資につきましては、公共投資は下げ止まりが見られ、国内の民間設備投資は先行きの不透明感から横ばいに推移しております	1
受注高につきましては、前連結会計年度を1.4％上回る1,858億8千万円となりました	1
環境システム事業は、主に廃棄物処理施設における長期の維持管理運営業務を受託したこと等により、前連結会計年度を56.2％上回る306億2千6百万円となりました	1
不動産事業は、前連結会計年度を3.9％上回る15億9千2百万円となりました	1
不動産事業は、15億9千2百万円と前連結会計年度と比較し、3.9％の増収となりました	1
なお、一昨年同期との比較では営業利益は30億6千1百万円、率にして103.7％の増益（一昨年同期の営業利益は29億5千1百万円）であり、前連結会計年度から引き続き高い利益水準を維持しております	1
受注高は前連結会計年度を56.2％上回る306億2千6百万円、売上高は前連結会計年度を2.5％下回る182億7千1百万円、セグメント利益（経常利益）は6億7千1百万円（前連結会計年度はセグメント損失3億1千5百万円）となりました	1
当連結会計年度における当社グループを取り巻く経済環境は、国内では輸出や生産は持ち直しの動きが続いており、企業収益も改善の動きが見られるなど、景気は緩やかな回復基調で推移した	1
建設市場においては、国内では公共投資は底堅く推移しており、民間設備投資は企業収益の改善等を背景に緩やかな回復基調で推移した	1
利益率については、工事採算の改善、経費の削減にグループを挙げて取り組んだ結果、経常利益率6.4％と過去最高を更新することができた	1
電力工事部門は、電力会社向けの送変電設備工事が増加したことに加え、再生可能エネルギー市場への対応強化により、受注高は169億８百万円（前期比8.2%増）、売上高は153億49百万円（同37.5%増）となった	1
当連結会計年度におけるわが国の経済は、英国のＥＵ離脱問題や米国新政権の政策などを始め、海外情勢に大きな変化が見られたものの、景気は雇用・所得環境や企業収益の改善を背景に、緩やかな回復の動きを続けてきた	1
そのような中、建設業界においては、民間設備投資並びに公共投資の底堅い動きと共に、東京オリンピック関連工事や都市再開発工事の本格化なども相俟って、建設需要は引き続き好調に推移してきた	1
売上高は、大幅に増加した期首の手持工事が順調に進捗したことなどから、前連結会計年度に比べ323億13百万円増加（10.9％増）し、3,289億15百万円となった	1
セグメント利益は、売上高の増加に伴い、前連結会計年度に比べ48億２百万円増加し、290億71百万円となった	1
セグメント利益は、前連結会計年度に比べ４億84百万円増加し、15億０百万円となった	1
当連結会計年度におけるわが国の経済は、政府や日本銀行による各種施策効果もあり、引き続き穏やかな回復基調で推移してまいりました	1
設備投資は企業収益が高水準で推移するなかで、緩やかな増加基調にあり、個人消費は雇用・所得環境の改善を背景に持ち直しの動きが見られました	1
建設業界におきましては、再開発事業や経済対策に伴う公共事業の増加を背景に、市況は堅調に推移いたしました	1
その結果、受注高につきましては、前連結会計年度比0.6％増の773億65百万円となりました	1
利益につきましては、営業利益は前連結会計年度比20.0％増の56億8百万円、経常利益は前連結会計年度比10.0％増の69億76百万円、親会社株主に帰属する当期純利益は前連結会計年度比12.2％増の52億7百万円となりました	1
売上高は60億90百万円（前連結会計年度比12.0％増）、営業利益は3億16百万円（前連結会計年度比43.1％増）となりました	1
国内経済は、個人消費や設備投資で一部遅れはあったものの、雇用情勢及び企業収益の改善等により、緩やかな回復基調で推移するとともに、九州・沖縄における経済状況も、被災地における挽回生産の継続や消費者マインドの改善等に伴い、緩やかに回復してきています	1
当連結会計年度の業績につきましては、受注高は、情報通信工事業及び設備工事等の増加と新規連結によるその他の事業が順調に推移したことにより、534億９千８百万円（前期比4.6％増）となり、完成工事高は、その他の事業は増加しましたが、情報通信工事業における前期繰越工事や社会インフラ関連工事の減少等により、504億３千８百万円（前期比2.0％減）となりました	1
損益につきましては、完成工事高は減少したものの、工事原価率の改善等により営業利益は11億２百万円（前期比189.5％増）、経常利益は13億８千３百万円（前期比114.9％増）、親会社株主に帰属する当期純利益は８億３百万円（前期比211.7％増）となりました	1
通信設備の健全化工事、台風・豪雨災害の復旧工事、保守業務及び移動体の基地局建設工事等の受注は増加しましたが、光コラボレーションモデル等の需要変動による光開通工事、社会インフラ整備工事などの完成工事高が減少したことにより、受注高は394億１千６百万円（前期比2.8％増）、完成工事高は372億９千５百万円（前期比4.0％減）となりました	1
熊本地震の復旧工事や太陽光の大型案件の受注などにより、受注高は77億４千５百万円（前期比18.6％増）、完成工事高は71億４千５百万円（前期比12.7％増）となりました	1
一方で、米国や中国をけん引役として、生産や輸出が持ち直し、企業業績が改善に向かうなど一部に明るい動きも見られました	1
建設業界におきましては、公共投資が底堅く推移し、民間設備投資も企業収益の改善を受け、堅調に推移しました	1
受注工事高は、前連結会計年度比503百万円増の144,007百万円となりました	1
完成工事総利益は、完成工事高は減少したものの、完成工事総利益率の改善により、前連結会計年度比1,075百万円増の17,788百万円となりました	1
営業利益は、完成工事総利益の増加を受け、前連結会計年度比213百万円増の6,750百万円となりました	1
経常利益は、営業利益の増加を受け、前連結会計年度比168百万円増の6,939百万円となりました	1
親会社株主に帰属する当期純利益は、特別利益として固定資産売却益52百万円、特別損失として災害による損失76百万円（熊本地震関連損失）等を計上し、法人税、住民税及び事業税、法人税等調整額及び非支配株主に帰属する当期純損失を控除した結果、前連結会計年度比390百万円増の4,638百万円となりました	1
当連結会計年度における我が国経済は、企業収益や雇用・所得環境が改善傾向にあるなど、緩やかな回復基調が続きました	1
当連結会計年度の業績につきましては、受注高802億円（前期比0.1％増）、売上高784億円（前期比1.4％増）となりました	1
利益面では、コストダウンの推進など収益体質の改善に向けた取り組みの成果により、営業利益46億70百万円（前期比26.5％増）、経常利益46億91百万円（前期比26.2％増）、親会社株主に帰属する当期純利益29億70百万円（前期比41.9％増）となりました	1
当セグメントにおいては、社会インフラ工事、産業システム工事、並びに太陽光以外の発電設備工事を行っており、受注高は233億円 (前期比5.9％増)、売上高は221億円 (前期比9.1％増)、営業利益は23億84百万円（前期比38.1％増）となりました	1
受注高、売上高は発電設備工事が好調に推移したことから前期を上回りました	1
営業損益は工事採算の改善により前期を上回りました	1
当セグメントにおいては、産業プロセス空調設備工事、一般空調・衛生設備工事を行っており、受注高は223億円（前期比22.5％増）、売上高は206億円（前期比0.4％減）、営業利益は16億85百万円（前期比12.9％増）となりました	1
受注高は産業プロセス空調設備工事、一般空調・衛生設備工事ともに好調に推移したことから前期を上回りました	1
売上高は前期並みに推移しましたが、営業損益は工事採算の改善により前期を上回りました	1
営業損益は工事採算の改善により前期を上回りました	1
当セグメントにおいては、電力送電工事、情報通信工事を行っており、受注高は62億円（前期比1.3％減）、売上高は51億円（前期比13.1％増）、営業利益は1億95百万円（前期比66.7％増）となりました	1
売上高は工事量の増加により前期を上回りました	1
営業損益は情報通信工事の工事採算の改善により前期を上回りました	1
当セグメントにおいては、海外における設備工事を行っており、受注高は80億円（前期比41.9％増）、売上高は61億円（前期比18.7％増）、営業利益は44百万円（前期比69.3％減）となりました	1
受注高、売上高はカンボジア、ミャンマーが好調に推移したことから前期を上回りました	1
当セグメントにおいては、物品販売及び補修・修理等のサービス事業を行っており、受注高は18億円（前期比8.8％減）、売上高は20億円（前期比12.7％増）、営業利益は4億93百万円（前期比34.1％増）となりました	1
当事業年度におけるわが国経済は、個人消費に力強さは見られなかったものの、企業収益環境の改善の持続や雇用所得環境の改善が見られ、また設備投資にも緩やかな持ち直しが見られるなど、全体として景気は緩やかな回復基調で推移いたしました	1
建設業界におきましては、平成28年度第２次補正予算に係る政府建設投資が第４四半期に一部出来高として寄与し、政府建設投資は対前事業年度比で増加しました	1
民間建設投資は、日銀のマイナス金利政策による金利の低下や相続税の節税対策による貸家の着工増で住宅建設投資が増加したことから堅調に推移しました	1
各段階の利益につきましては、予想売上高の減少や販管費の増加がありましたが、工期短縮など施工効率の向上に取組むとともにコスト低減に注力した結果、完成工事総利益率が改善し営業利益129百万円（前事業年度比7.0％増）、経常利益143百万円（前事業年度比4.0％増）、当期純利益148百万円（前事業年度比19.5％増）となりました	1
完成工事高につきましては、空洞充填工事の完成工事高が619百万円（前事業年度比5.2％減）と減少しましたが、軽量盛土工事の完成工事高が1,645百万円（前事業年度比13.4％増）と増加し、また受注高は大幅に減少しましたが前事業年度からの繰越工事が多かった管路中詰工事の完成工事高が696百万円（前事業年度比1.0％増）と増加したことから、気泡コンクリート工事全体の完成工事高は2,961百万円（前事業年度比6.0％増）と増加いたしました	1
地盤改良工事の受注高は1,078百万円（前事業年度比5.5％増）と増加いたしました	1
受注高は193百万円（前事業年度比1,972.9％増）、完成工事高につきましても99百万円（前事業年度比961.0％増）となりました	1
以上の結果、当連結会計年度の売上高は、327億67百万円（前年同期比7.9％増）となり増加いたしました	1
損益面では、売上高の増加要因やコスト削減に努めた結果、営業利益は５億１百万円（前年同期比176.2％増）、経常利益は５億41百万円（前年同期比159.1％増）となり、親会社株主に帰属する当期純利益は遊休土地の減損損失計上もあり３億91百万円（前年同期比156.0％増）となりました	1
食肉加工品部門につきましては、春の新商品の売上が好調に推移したことや歳暮ギフトの販売も回復してきたことから、売上高は増加いたしました	1
この結果、この部門の売上高は126億26百万円（前年同期比7.6％増）となりました	1
惣菜その他加工品部門につきましては、ハンバーグ類や簡便性を重視した惣菜商品の新商品の売上が好調に推移したため、売上高は増加しました	1
この結果、この部門の売上高は45億73百万円（前年同期比14.2％増）となりました	1
食肉部門につきましては、輸入牛肉及び輸入豚肉はブランド商品の拡販に努め売上高は増加いたしました	1
国産牛肉は前期に事業所を設置し新規開拓を行った結果、売上高は増加しました	1
国産豚肉につきましては、販売単価は前期を下回りましたが販売数量の増加により売上高は増加いたしました	1
また、食肉一次加工品につきましても、販売促進に努めた結果、売上高は増加いたしました	1
この結果、この部門の売上高は154億15百万円（前年同期比6.4％増）となりました	1
その他部門につきましては、売上高は１億51百万円（前年同期比9.3％増）となりました	1
当連結会計年度のわが国経済は、雇用・所得環境の改善から個人消費は持ち直しの動向が見られるなど緩やかな回復基調が続きましたが、英国の欧州連合(ＥＵ)離脱決定や米国新政権の政策動向による影響など、海外経済は不確実な状況で推移いたしました	1
その後、ブラジルの天候回復やタイの歩留改善による生産量改善見通しにより下落傾向となり、16.76セントで当期を終了いたしました	1
このような状況の中、天候不順による販売量への影響はあったものの販売価格の上昇により、売上高は前年並みの13,363百万円(前連結会計年度比0.7％増)となり、営業利益は1,143百万円(前連結会計年度比0.1％増)となりました	1
当連結会計年度におけるわが国経済は、海外経済の不確実な情勢が継続したことなどにより、為替相場や株式市場が不安定に推移したものの、政府主導の経済政策、金融緩和を背景に企業の収益や雇用、所得環境の改善が続き、緩やかな回復基調で推移いたしました	1
その結果、天候要因による影響を受けた品目があったものの、ファミリーサイズ商品群やエクセレントスイーツシリーズ、小箱チョコレート商品群などが好調に推移したことから、ビスケット品目、チョコレート品目、キャンデー品目などが伸張し売上高は前期を上回りました	1
また、利益面では、売上高の伸張とコスト削減、生産性の向上、経費の効率的な使用に取り組んだことなどにより、営業利益、経常利益、親会社株主に帰属する当期純利益はともに前期を上回りました	1
菓子の合計売上高は106,763百万円（対前期比102.6％）となりました	1
加えて、季節に合わせた商品企画として、抹茶フェア、パインフェア、夏塩フェア、いも・栗フェア、ホワイトフェア、いちごフェアを実施したことにより、ファミリーサイズ商品群やマイベネフィット商品群などが好調に推移しました	1
米菓品目の「チーズおかき」シリーズを中心に加工米菓商品群が伸張したほか、キャンデー品目の「フェットチーネグミ」シリーズにおいては、ミックスフルーツソーダ味やはちみつレモン味などの新味の発売に加え、ハードな食感がお楽しみいただける「フェットチーネグミコーラ味ハードボイルド」などを品揃えし好評をいただきました	1
一方、期間限定で東京駅一番街にオープンした当社初のアンテナショップ「パティスリーブルボン」では、特別に仕立てたクッキーの限定商品「ラングレイス」や「ルマンドアソート」などに大きな反響をいただきました	1
ビスケット品目のほかチョコレート品目、キャンデー品目、米菓品目などが伸張したことから、品目全体でも前期を上回りました	1
飲料・食品・その他の合計売上高は6,155百万円（対前期比112.4％）となりました	1
飲料・食品品目は、健康志向の高まりを受けて、濃厚でまろやかな「おいしいココナッツミルク」が好調に推移しました	1
販売ルートの拡大などにより「牛乳でおいしくホットなココア」が伸張しました	1
機能性食品は、栄養調整食品「スローバー」シリーズにおいて、新味を品揃えし取り扱いの拡大により伸張しました	1
また、酒類販売事業は、期間限定商品として「ＦＬＹＩＮＧ　ＩＰＡ」を発売したほか、受託生産や輸出が引き続き好調に推移したことから前期を上回りました	1
その結果、品目全体でも前期を上回りました	1
以上の営業活動により業績の向上に努めてまいりました結果、当連結会計年度の売上高は112,918百万円（対前期比103.1％）、営業利益は4,809百万円（対前期比110.1％）、経常利益は4,666百万円（対前期比112.4％）、親会社株主に帰属する当期純利益は3,652百万円（対前期比140.1％）となりました	1
当連結会計年度におけるわが国経済は、雇用情勢および所得環境の改善などにより、景気は緩やかな回復基調をたどりましたが、海外経済の不確実性の高まりなどを受け、先行きは不透明な状況で推移しました	1
このような取り組みを中心に販売強化に努めた結果、乳製品全体では前期を上回る実績となりました	1
これらの結果、飲料および食品製造販売事業部門（日本）の連結売上高は204,130百万円（前期比2.6％増）となりました	1
ブラジルにおいては、消費者の健康意識向上による低カロリー製品ニーズの高まりに応えるため、昨年７月から乳製品乳酸菌飲料「ヤクルト40ライト」の販売を開始しました	1
一方、プロ野球興行については、神宮球場において各種イベントやさまざまな情報発信を行うなど、積極的なファンサービスに取り組んだ結果、入場者数が増加しました	1
海外については、円高による為替換算の影響を受けましたが、現地通貨ベースでは、しょうゆは北米、欧州、アジア・オセアニアともに売上を伸ばし、食料品卸売事業も好調に推移し、前期の売上を上回りました	1
この結果、当連結会計年度の連結グループの売上高は4,021億７千４百万円（前期比98.5％）、営業利益は328億４千２百万円（前期比100.7％）、経常利益は320億３千７百万円（前期比103.2％）、親会社株主に帰属する当期純利益は238億１千万円（前期比119.3％）となりました	1
しょうゆは、家庭用分野では「いつでも新鮮」シリーズが「新鮮な生しょうゆのおいしさ」、「鮮度維持」、「使いやすさ」という付加価値が市場に浸透し、商品ラインアップ、店頭販促やテレビ広告も強化した結果、順調に拡大を続けており、部門全体で数量、金額ともに前期を上回りました	1
つゆ類は、家庭用分野では、「いつでも新鮮贅沢白だし」「鯛だし塩鍋つゆ」「海老だし鍋つゆ」「だししっかり減塩つゆ」等の高付加価値品が売上に寄与しましたが、主力の「本つゆ」のリニューアルにともなう価格体系変更による売上減もあり、つゆ類全体としては前期を下回りました	1
たれ類は、主力商品である「わが家は焼肉屋さん」で「ジワっと辛い旨辛だれ」等の商品ラインアップの強化や、市場が堅調に推移したことにより、たれ類全体として前期を上回りました	1
デルモンテ調味料は、「リコピンリッチ」のテレビ広告効果もあり、高付加価値品を中心に主力のトマトケチャップが伸長し、前期を上回りました	1
豆乳飲料は、健康志向の高まりを背景に、特定保健用食品の商品が伸長しました	1
